{
  "_hinweis": "DEMO-DATEN für Phase 1. Sie zeigen jedes Feature aus docs/FEATURES.md mindestens einmal: Abhängigkeitskette, Ersetzt-Gruppe, Konflikt, Synergie, Ergänzt mit +/-, Preis einmalig und Abo, Kompat-Warnung bestätigt und Vermutung, archivierter Eintrag, Alt-Stack-Eintrag, Bundle. Sie sind NICHT nach docs/RECHERCHE.md recherchiert — deshalb durchgehend qualitaet ungeprueft und leeres geprueft_am. In Phase 3 werden sie durch echte Recherche-Runden ersetzt.",
  "catalogVersion": "3.0-demo",
  "runde": null,
  "thema": "Demodaten zum Durchtesten aller Features",
  "erstellt": "2026-08-12",
  "plugins": [
    {
      "id": "ox_lib",
      "name": "ox_lib",
      "autor": "Overextended",
      "kategorie": "basis",
      "essenziell": true,
      "beschreibung": "Standardbibliothek für Menüs, Benachrichtigungen, Callbacks und Fortschrittsbalken. Sehr viele Qbox-Scripts setzen sie voraus, ohne sie startet ein großer Teil des Servers nicht.",
      "features": ["Menü- und Dialogsystem", "Callbacks", "Fortschrittsbalken", "Zielsystem-Anbindung"],
      "link": "https://github.com/overextended/ox_lib",
      "link_status": "ungeprueft",
      "framework": "standalone",
      "lizenz": "open_source",
      "qualitaet": "ungeprueft",
      "tipp": "Immer zuerst starten — fast alles andere hängt daran."
    },
    {
      "id": "qbx_core",
      "name": "qbx_core",
      "autor": "Qbox Project",
      "kategorie": "basis",
      "essenziell": true,
      "beschreibung": "Der Kern des Qbox-Frameworks mit Spielerverwaltung, Jobs und der QBCore-Bridge. Ohne ihn läuft kein Qbox-Server.",
      "features": ["Spielerverwaltung", "Job- und Gang-System", "QBCore-Bridge"],
      "link": "https://github.com/Qbox-project/qbx_core",
      "link_status": "ungeprueft",
      "framework": "qbox_nativ",
      "lizenz": "open_source",
      "abhaengigkeiten": ["ox_lib"],
      "qualitaet": "ungeprueft"
    },
    {
      "id": "qbx_policejob",
      "name": "qbx_policejob",
      "autor": "Qbox Project",
      "kategorie": "staat",
      "beschreibung": "Polizei-Job für Qbox mit Dienstverwaltung, Handschellen, Zellen und Beweismitteln. Baut direkt auf qbx_core auf und bildet damit das dritte Glied der Abhängigkeitskette.",
      "features": ["Dienst an/ab", "Festnahme und Zellen", "Beweismittel", "Fahrzeug-Garage für den Dienst"],
      "link": "https://github.com/Qbox-project/qbx_policejob",
      "link_status": "ungeprueft",
      "framework": "qbox_nativ",
      "lizenz": "open_source",
      "abhaengigkeiten": ["qbx_core"],
      "qualitaet": "ungeprueft"
    },
    {
      "id": "ox_inventory",
      "name": "ox_inventory",
      "autor": "Overextended",
      "kategorie": "ui",
      "gruppe": "inventar",
      "essenziell": true,
      "beschreibung": "Slot-basiertes Inventar mit Metadaten, Gewicht und Container-Unterstützung. Unter Qbox das Standard-Inventar, auf das viele andere Scripts direkt aufsetzen.",
      "features": ["Drag & Drop", "Metadaten pro Item", "Gewichtssystem", "Fahrzeug- und Lager-Container", "Shops und Crafting"],
      "link": "https://github.com/overextended/ox_inventory",
      "link_status": "ungeprueft",
      "framework": "qbox_nativ",
      "lizenz": "open_source",
      "abhaengigkeiten": ["ox_lib"],
      "konflikte": ["qs-inventory", "qb-inventory"],
      "pro": ["Qbox-Standard", "Aktiv gepflegt", "Quelloffen und damit selbst reparierbar"],
      "contra": ["Umstellung bestehender Scripts nötig"],
      "neutral": ["Eigene Item-Definitionen erforderlich"],
      "qualitaet": "ungeprueft"
    },
    {
      "id": "qs-inventory",
      "name": "Quasar Inventory",
      "autor": "Quasar Store",
      "kategorie": "ui",
      "gruppe": "inventar",
      "beschreibung": "Kommerzielles Inventar mit eigener Oberfläche, das Shop- und Crafting-Funktionen gleich mitbringt. Kostenpflichtig und verschlüsselt ausgeliefert.",
      "features": ["Drag & Drop", "Metadaten pro Item", "Eigenes Shop-System", "Crafting-System", "Hotbar"],
      "link": "https://quasar-store.com",
      "link_status": "gesperrt",
      "framework": "qbcore_bridge",
      "lizenz": "escrow",
      "preis": { "betrag": 45, "waehrung": "EUR", "typ": "einmalig" },
      "konflikte": ["ox_inventory", "qb-inventory"],
      "bundle": "Bringt ein eigenes Shop- und Crafting-System mit — kann mit separaten Shop-Scripts kollidieren.",
      "kompat_warnung": {
        "text": "Greift laut Shop-Beschreibung auf qb-inventory-Exports zurück; unter Qbox ist dafür die Bridge nötig, die nicht jeden Aufruf abdeckt.",
        "sicherheit": "bestaetigt"
      },
      "pro": ["Shop und Crafting bereits enthalten", "Fertige Oberfläche"],
      "contra": ["Kostenpflichtig", "Escrow — bei Bridge-Problemen nicht selbst reparierbar"],
      "neutral": ["Eigenes Shop-System überschneidet sich mit vorhandenen Shop-Scripts"],
      "qualitaet": "ungeprueft"
    },
    {
      "id": "qb-inventory",
      "name": "qb-inventory",
      "autor": "QBCore Framework",
      "kategorie": "ui",
      "gruppe": "inventar",
      "beschreibung": "Das klassische Inventar aus dem QBCore-Stack. Läuft unter Qbox nur eingeschränkt und gilt dort nicht als Standard, bleibt aber zur Einordnung im Katalog.",
      "features": ["Drag & Drop", "Gewichtssystem", "Shops"],
      "link": "https://github.com/qbcore-framework/qb-inventory",
      "link_status": "ungeprueft",
      "framework": "qbcore_only",
      "lizenz": "open_source",
      "konflikte": ["ox_inventory", "qs-inventory"],
      "stack_hinweis": "Alter qb-Stack, nicht Qbox-Standard. Unter Qbox wird ox_inventory verwendet.",
      "pro": ["Sehr viele ältere QBCore-Scripts erwarten genau dieses Inventar", "Umfangreiche Anleitungen im Umlauf"],
      "contra": ["Unter Qbox nicht der vorgesehene Weg", "Erfordert die Bridge und bleibt trotzdem heikel"],
      "neutral": ["Sinnvoll nur, wenn ein bestehender qb-Server migriert wird"],
      "qualitaet": "ungeprueft"
    },
    {
      "id": "ps-mdt",
      "name": "ps-mdt",
      "autor": "Project Sloth",
      "kategorie": "staat",
      "beschreibung": "Polizei- und Rettungsdienst-Datenbank mit Akten, Fahndungen und Berichten. Ergibt nur zusammen mit einem Polizei-Job Sinn, funktioniert technisch aber auch allein.",
      "features": ["Personenakten", "Fahndungsliste", "Strafzettel", "Berichtswesen"],
      "link": "https://github.com/Project-Sloth/ps-mdt",
      "link_status": "ungeprueft",
      "framework": "qbcore_bridge",
      "lizenz": "open_source",
      "abhaengigkeiten": ["ox_lib"],
      "synergie": ["qbx_policejob"],
      "kompat_warnung": {
        "text": "Stammt aus dem QBCore-Umfeld und wurde für Qbox nicht ausdrücklich freigegeben; ein Rest an Anpassungsaufwand ist zu erwarten.",
        "sicherheit": "vermutung"
      },
      "pro": ["Umfangreich", "Quelloffen"],
      "contra": ["Einrichtung aufwendig"],
      "qualitaet": "ungeprueft"
    },
    {
      "id": "ps-housing",
      "name": "ps-housing",
      "autor": "Project Sloth",
      "kategorie": "wohnen",
      "beschreibung": "Wohnungssystem mit kaufbaren Immobilien, Einrichtung und Zugangsverwaltung. Deckt das Wohnen ab, aber nicht den Immobilienhandel durch Spieler.",
      "features": ["Häuser kaufen und mieten", "Möblierung", "Schlüsselverwaltung", "Tresor im Haus"],
      "link": "https://github.com/Project-Sloth/ps-housing",
      "link_status": "ungeprueft",
      "framework": "qbcore_bridge",
      "lizenz": "open_source",
      "abhaengigkeiten": ["ox_lib"],
      "qualitaet": "ungeprueft"
    },
    {
      "id": "ps-realtor",
      "name": "ps-realtor",
      "autor": "Project Sloth",
      "kategorie": "wohnen",
      "beschreibung": "Makler-Erweiterung, mit der Spieler Immobilien selbst vermarkten und verkaufen können. Ersetzt kein Wohnungssystem, sondern baut auf einem auf.",
      "features": ["Maklerrolle für Spieler", "Besichtigungstermine", "Provisionen", "Angebotsverwaltung"],
      "link": "https://github.com/Project-Sloth/ps-realtor",
      "link_status": "ungeprueft",
      "framework": "qbcore_bridge",
      "lizenz": "escrow",
      "preis": { "betrag": 5, "waehrung": "EUR", "typ": "abo" },
      "abhaengigkeiten": ["ps-housing"],
      "ergaenzt": [
        {
          "id": "ps-housing",
          "plus": ["Spieler können Immobilien selbst vermarkten", "Provisionen als Einnahmequelle", "Besichtigungstermine als Rollenspiel-Anlass"],
          "minus": ["Laufende Kosten statt Einmalzahlung", "Zusätzliche Rolle, die besetzt werden will", "Ohne aktive Maklerspieler bleibt der Nutzen gering"]
        }
      ],
      "pro": ["Erweitert das Wohnungssystem um echtes Rollenspiel"],
      "contra": ["Abo-Kosten", "Escrow — nicht selbst reparierbar"],
      "neutral": ["Lohnt erst ab einer gewissen Spielerzahl"],
      "qualitaet": "ungeprueft"
    },
    {
      "id": "qbx_radio",
      "name": "qbx_radio",
      "autor": "Qbox Project",
      "kategorie": "kommunikation",
      "beschreibung": "Funksystem mit Kanälen für Fraktionen und Gruppen. Das Repo wurde eingestellt, als Nachfolger wird mm_radio genannt.",
      "features": ["Sprachkanäle", "Kanalpasswörter", "Fraktionsfunk"],
      "link": "https://github.com/Qbox-project/qbx_radio",
      "link_status": "ungeprueft",
      "framework": "qbox_nativ",
      "lizenz": "open_source",
      "abhaengigkeiten": ["ox_lib"],
      "archiviert": {
        "text": "Repo wurde vom Qbox-Projekt archiviert und erhält keine Updates mehr.",
        "nachfolger": "mm_radio"
      },
      "contra": ["Keine Updates mehr", "Nachfolger noch nicht im Katalog erfasst"],
      "qualitaet": "ungeprueft"
    }
  ],
  "updates": []
}
